{
  "$schema": "../../merger/repoground/contracts/repobrief-status-truth.v1.schema.json",
  "audit_package_coverage": "selected_remediation_packages",
  "audit_packages": [
    {
      "limitations": [
        "No complete secret detection, repository understanding or release-readiness claim is established."
      ],
      "promotion": "not_applicable",
      "scope": "finalization control plane and required ai-context aggregation",
      "status": "done",
      "task_id": "TASK-REPOBRIEF-AUDIT-FINAL-CONTROL-001",
      "verification": "main_verified"
    },
    {
      "limitations": [
        "Question recall@10 is 5.0 percent and expected-target recall@10 is 1.666667 percent; measurement closure is not ranking sufficiency."
      ],
      "promotion": "blocked",
      "scope": "canonical repository-specific retrieval measurement",
      "status": "done",
      "task_id": "TASK-REPOBRIEF-AUDIT-RETRIEVAL-MEASUREMENT-001",
      "verification": "main_verified"
    },
    {
      "limitations": [
        "Direct Lenskit references remain runtime-verified; the separate transitive task is locally validated and still awaits final Lenskit PR/main verification."
      ],
      "promotion": "not_applicable",
      "scope": "direct Lenskit-owned workflow references and caller contract",
      "status": "done",
      "task_id": "TASK-LENSKIT-AUDIT-CI-SUPPLY-CHAIN-001",
      "verification": "runtime_verified"
    },
    {
      "limitations": [
        "metarepo PRs #646/#647, WGX PR #639 and Lenskit PR #985 are merged; all 22 checks on Lenskit merge ba09d897ee38fba90a5ad8100291a8f50df1cfd3 pass.",
        "Issue-comment run 29202069888 loaded the pinned metarepo workflow and pinned Actions, found no command and completed before repository_dispatch, reply or reaction writes.",
        "The smoke exposed a non-failing app-id deprecation warning; this scoped task does not establish dependency safety, automatic discovery outside the recorded graph, complete workflow correctness, test completeness or readiness."
      ],
      "promotion": "not_applicable",
      "scope": "recursive Actions graph reached through the two pinned upstream reusable workflow callers",
      "status": "done",
      "task_id": "TASK-LENSKIT-AUDIT-CI-SUPPLY-CHAIN-UPSTREAM-TRANSITIVE-001",
      "verification": "runtime_verified"
    },
    {
      "limitations": [
        "No cross-browser, complete interaction or visual-regression coverage is established."
      ],
      "promotion": "allowed",
      "scope": "required digest-pinned Chromium browser gate",
      "status": "done",
      "task_id": "TASK-LENSKIT-AUDIT-BROWSER-GATE-001",
      "verification": "runtime_verified"
    },
    {
      "limitations": [
        "The projection remains selected and does not establish documentation completeness, semantic truth, product readiness or release readiness."
      ],
      "promotion": "not_applicable",
      "scope": "task, roadmap and selected claim-freshness reconciliation",
      "status": "done",
      "task_id": "TASK-REPOBRIEF-AUDIT-STATUS-TRUTH-001",
      "verification": "main_verified"
    },
    {
      "limitations": [
        "PR #978 merged as 50de5cd4c95f473fff5d6420d0e8c99ba92771bf after diff-bound self-review; all PR and main checks, including release-candidate, passed.",
        "Ruleset 18784275 requires release-candidate for future main merges.",
        "Public distribution is permitted under the current Apache-2.0 project license per docs/decisions/repoground-public-license-decision.v1.json; the public-license decision and reviewed source-only distribution boundary are complete; bundled third-party binaries, containers, model weights and datasets remain outside that clearance.",
        "The optional semantic/Torch dependency closure is hash-locked for the reviewed CPython 3.12/Linux x86-64 CPU-only scope, remains optional/default-off, and stays outside the default candidate contract.",
        "Done does not establish product readiness, public release readiness, runtime correctness, test completeness or absence of vulnerabilities."
      ],
      "promotion": "allowed",
      "scope": "license, reproducible dependency, release and rollback evidence",
      "status": "done",
      "task_id": "TASK-LENSKIT-AUDIT-RELEASE-PACKAGING-001",
      "verification": "main_verified"
    },
    {
      "limitations": [
        "The ratchets bound measured graph noise and C901 regressions only; they do not establish runtime reachability, complete entrypoint discovery, semantic layer truth, general maintainability, test completeness or absence of problems below the C901 threshold.",
        "PR #990 merged as 72c2c7f164eed720de8a802e52b4a493365e8bec; the merged tree matched the reviewed PR tree and the fresh main export passed the ratchet and focused tests."
      ],
      "promotion": "allowed",
      "scope": "graph-noise and complexity ratchets",
      "status": "done",
      "task_id": "TASK-REPOBRIEF-AUDIT-GRAPH-MAINTAINABILITY-001",
      "verification": "main_verified"
    },
    {
      "task_id": "TASK-REPOBRIEF-PACKAGE-RENAME-DECISION-001",
      "scope": "product, repository and Python namespace compatibility decision",
      "status": "done",
      "verification": "main_verified",
      "promotion": "not_applicable",
      "limitations": [
        "The 2.x decision does not establish a complete inventory of unknown consumers, public package readiness or a permanent prohibition on a future breaking-major rename."
      ]
    },
    {
      "task_id": "TASK-REPOBRIEF-READONLY-ADAPTER-NO-MIRROR-001",
      "scope": "protocol-neutral registered-bundle read-only adapter",
      "status": "done",
      "verification": "main_verified",
      "promotion": "allowed",
      "limitations": [
        "The code-level adapter does not establish a deployed MCP server, authentication, remote freshness, answer correctness, review completeness or merge readiness."
      ]
    },
    {
      "task_id": "TASK-REPOBRIEF-WORKBENCH-USEFULNESS-EVAL-001",
      "scope": "bounded eight-question Workbench navigation utility evaluation",
      "status": "done",
      "verification": "main_verified",
      "promotion": "allowed",
      "limitations": [
        "The fixed-goldset result does not establish general retrieval quality, natural-language answer correctness, actual agent confidence, patch correctness, review completeness or default promotion."
      ]
    }
  ],
  "authority": "governance_projection",
  "claim_freshness": {
    "authority": "diagnostic_signal",
    "coverage": "selected_declared_claims_only",
    "does_not_prove": [
      "documentation completeness",
      "documentation correctness outside tracked claims",
      "roadmap completeness",
      "product readiness",
      "release readiness"
    ],
    "green_means": "Every tracked claim matches the evidence declared for that claim.",
    "path": "docs/doc-freshness-registry.yml",
    "tracked_claim_count": 7
  },
  "does_not_establish": [
    "complete repository understanding",
    "documentation completeness",
    "semantic truth of every claim",
    "test or review completeness",
    "absence of regressions or vulnerabilities",
    "product readiness",
    "release readiness"
  ],
  "health_semantics": {
    "forbidden_inferences": [
      "product_ready",
      "release_ready",
      "review_complete",
      "test_complete",
      "semantic_truth",
      "runtime_correct"
    ],
    "pass_means": "Only the checks declared by that specific health or CI report passed for the observed artifact or commit."
  },
  "kind": "lenskit.repobrief_status_truth",
  "observed_on": "2026-08-26",
  "open_followups": [
    {
      "axis": "operational_readiness",
      "reason": "Operational readiness remains partial because this projection aggregates bounded runtime surfaces rather than one actionable host defect.",
      "binding": {
        "kind": "no_task",
        "rationale": "No single Bureau task is registered from this aggregate status alone; a concrete fresh runtime defect must enter Bureau through separate evidence-bound intake."
      },
      "covers": [
        "system_maturity:operational_readiness"
      ]
    },
    {
      "axis": "product_readiness",
      "reason": "Product readiness is intentionally not established by completion of bounded implementation slices.",
      "binding": {
        "kind": "no_task",
        "rationale": "A future product-readiness promotion requires a separate accepted product-level contract and evidence; this projection must not manufacture that task or infer readiness from done slices."
      },
      "covers": [
        "system_maturity:product_readiness"
      ]
    },
    {
      "axis": "release_readiness",
      "reason": "Release readiness is intentionally not established merely because source distribution is permitted and release-candidate checks are green.",
      "binding": {
        "kind": "no_task",
        "rationale": "A concrete release decision belongs to separate operator/Bureau intake when requested; historical or bounded release checks are not reopened as synthetic follow-up work."
      },
      "covers": [
        "system_maturity:release_readiness"
      ]
    },
    {
      "axis": "product_readiness",
      "reason": "Canonical review retrieval remains measured below its acceptance thresholds and default promotion is blocked.",
      "covers": [
        "audit_package:TASK-REPOBRIEF-AUDIT-RETRIEVAL-MEASUREMENT-001:promotion"
      ],
      "binding": {
        "kind": "no_task",
        "rationale": "The measured retrieval slice and its default-promotion decision are already completed for their bounded scopes. A new Bureau task is not created from the unchanged blocked result alone; fresh materially improved retrieval evidence or an explicit promotion request is required before new work is registered."
      }
    }
  ],
  "release_identity": {
    "license_expression": "Apache-2.0",
    "license_file": "LICENSE",